,Date,Headline,Positive,Negative,Neutral
299,2018-04-25,"NYSE Spokesperson Offers Insight On Suspension In Amazon, Booking Holdings, Alphabet, Tells Benzinga Suspension Did Not Impact Vast Majority Of Clients, Notes Stocks Impacted Can Continue To Trade On Other Exchanges, Including NYSE American, Arca",0.032261528074741364,0.9220155477523804,0.47861313819885254
300,2018-04-26,UPDATE: Shares Of ADT Moving Lower Following The TechCrunch Article On Amazon Selling Home Security Services,0.8864100575447083,0.9662700891494751,0.10076703131198883
301,2018-04-27,"Netflix, Amazon Shares Unaffected Following Report EU Regulators Have Struck Deal On Forcing Cos. To Pay Levies To Fund European Content",0.07873241603374481,0.8961929678916931,0.025074569508433342
302,2018-05-02,"Square, Paypal Fall As Amazon Pay Works To Poach Market Share",0.010665603913366795,0.9600943922996521,0.029240021482110023
303,2018-05-03,"PetMed Express Shares Down 1.4% Since Session Highs; Traders Recently Circulated Word Amazon Launched Wag, A Line Of Its Own Pet Products",0.014482362195849419,0.9731265902519226,0.0781959742307663
304,2018-05-09,Monro Shares Down 6.8% With Weakness Attributed To News of Sears/Amazon Tire Install Partnership; BZ NOTE: Nothing In Partnership Announcement Suggests Deal Is Exclusive Or Would Prohibit Similar Deals Between Amazon And Tire Service Providers,0.6544275283813477,0.9722227454185486,0.3368506133556366
305,2018-05-14,"Criteo Shares Fall ~$1.60 Over Last Min. Amid Report Amazon Will Challenge Google, Criteo In Wed Ads Tool Space",0.007957451045513153,0.966321587562561,0.025720924139022827
306,2018-05-29,TechCrunch Reports 'FCC Asks Amazon And Ebay To Stop Selling Fake Pay TV Boxes',0.016666272655129433,0.8341694474220276,0.1491643190383911
307,2018-05-30,Jabil Shares Up Slightly After Earlier Announcing Partnership With Amazon To Develop Smart Packaging Solutions,0.950273334980011,0.020823931321501732,0.02890271134674549
308,2018-06-06,Turtle Beach Shares Now Up 4% For Session; Spiked Higher Following Word Of Needham Comment Co. Products Are 'sold out or selling out everywhere'; BZ NOTE: Both Turtle Beach Website And Amazon Showing Availability Of Headsets,0.946803092956543,0.9704921245574951,0.039153262972831726
309,2018-06-07,"Lilly CEO Ricks Positive On JP Morgan, Berkshire, Amazon Health Care Coalition, Says 'If these 3 large cos. can use their scale, technology to create real change and move to value-based payments, it could move [health care] system forward'",0.806276798248291,0.007410879712551832,0.1863122582435608
310,2018-06-08,Morgan Stanley: Alibaba's Opportunity In China 'Vastly Greater' Than Amazon's U.S. Potential,0.9515931010246277,0.01175035908818245,0.03665660321712494
311,2018-06-11,National Beverage Shares Down 3.8%; Traders Recently Circulating Article From Sun. Morning 'Amazon is getting ready to crush LaCroix',0.9055755734443665,0.9703801274299622,0.08459362387657166
312,2018-06-12,"Sears Shares Spike Higher, Indicated Up 15% Premarket Amid Report Amazon Tire Deal With Sears Auto Center Has Expanded To Added 71 Stores",0.9461990594863892,0.025241481140255928,0.028559578582644463
313,2018-06-28,"CVS, Walgreens and Rite Aid Falling After Amazon Announces the Acquisition of an Online Pharmacy",0.833136260509491,0.9539917707443237,0.4063831865787506
314,2018-06-29,Jefferies Downgrades Walgreens On Amazon's Competitive Threat,0.009729421697556973,0.9421585202217102,0.04811205342411995
315,2018-07-12,"Equinix Reports Expanded Collaboration With Amazon Web Services Into Sao Paulo, Miami",0.9334365725517273,0.009977134875953197,0.056586235761642456
316,2018-07-13,Juniper Shares Moving Lower Following The Information Report On Amazon Challenging Networking Switch Space,0.02093842625617981,0.965817928314209,0.1330096274614334
317,2018-07-19,"Late Wednesday, Marketwatch Reported Amazon Denied July 13th Report From The Information That It Will Challenge Cisco With Networking Switch Sales",0.038955431431531906,0.8039736747741699,0.15707097947597504
318,2018-07-23,"Technology Select Sector SPDR ETF Up 0.7% After Hours Following Alphabet Earnings Beat, 5% Move Higher; Amazon Shares Up 0.7%, Facebook Up 0.9%, Netflix Up 0.2%",0.9424377083778381,0.02559969574213028,0.03196253627538681
319,2018-07-25,"Social Stocks Following Facebook Lower After Hours After Its Mixed Q2 Report: Facebook -16.8%, Twitter -5.9%, Snap -3.1%; FANG Stocks Also Lower: Amazon -2.2%, Netflix -2.9%, Alphabet -1%",0.007584848441183567,0.9740676283836365,0.02170809730887413
320,2018-07-26,"Monro, Inc. Teams Up With Amazon To Provide Tire Installation Services",0.810637891292572,0.007963723503053188,0.1813984215259552
321,2018-08-09,"Michael's Shares Spike ~2% Higher Following Credit Suisse Comments On Potentially Expanded Partnership With Co.'s Darice Wholesale Unit, Amazon; BZ NOTE: Michael's Last 10-Q Showed 'Darice does not meet materiality criteria...'",0.9014909863471985,0.07114873081445694,0.02736028842628002
322,2018-08-13,"India Reportedly Seeking New Rules For American Tech Companies Operating In The Country, To Shelter Homegrown Startups; Potential Negative For Amazon, Alphabet, Facebook, and Apple",0.01724189706146717,0.9517622590065002,0.030995795503258705
323,2018-08-14,"13F From Soros Fund Shows Reduced Stake In Activision Blizzard, Reduced Stake In Amazon From 44.2K to 29.9K Shares, Raised Stake In Aetna, New 2M Share Stake In AT&T",0.559929370880127,0.4515562355518341,0.29194706678390503
324,2018-08-28,Lands' End shares are up 9.7%; Move is being attributed to the company's connection to Sears and may be trading up in sympathy after Sears announced Amazon partnership.,0.9555712938308716,0.02007356286048889,0.02435515820980072
325,2018-08-29,"Morgan Stanley Lifts Amazon's Price Target To $2,500, Bullish On Waymo's Prospects For Alphabet",0.8848003149032593,0.05939290672540665,0.12999579310417175
326,2018-09-17,Accenture and Merck Collaborate with Amazon Web Services to Launch a Research Platform to Drive Innovation in Drug Discovery and Scientific Research,0.7696607708930969,0.007328768260776997,0.22301052510738373
327,2018-09-19,"Kroger, Costco Shares Moved Lower Following Report Amazon Planning For Up To 3K Cashierless Stores By 2021",0.022280775010585785,0.9548842906951904,0.022834962233901024
328,2018-09-20,ADT shares are trading up 7% after Amazon announced users can sync Alexa devices with ADT to send security alerts to dispatchers.,0.9513741135597229,0.020253367722034454,0.028372542932629585
329,2018-09-24,Google Home Is Gaining Ground On Amazon Echo,0.819549024105072,0.01129000075161457,0.16916103661060333
330,2018-09-25,Salesforce And Amazon Web services Expand Global Strategic Alliance To Accelerate Enterprises' Digital Transformations,0.9103585481643677,0.009152729995548725,0.08048868924379349
331,2018-10-01,UPDATE: Amazon Has Reportedly Been In Discussions With At Least Three Major Media Companies To Bring Their Programming To The New Fire TV Service,0.7974351048469543,0.010672091506421566,0.1918928623199463
332,2018-10-03,"eBay Sends Cease-And-Desist Letter To Amazon, Claims Illegal Poaching",0.019384611397981644,0.9443169236183167,0.08254555612802505
333,2018-10-04,'Europe moves forward with content quotas for Netflix and Amazon' -Engadget,0.8345741629600525,0.00849065463989973,0.15693512558937073
334,2018-10-11,Monro And Amazon Expand Collaboration To Provide Tire Installation Services Across Eastern United States,0.9362143874168396,0.011813309043645859,0.05197232961654663
335,2018-10-16,"Facebook Shares Up 0.8% After Hours Following Netflix Earnings, Subsequent Move Higher In NFLX; Amazon Up 1%, Apple Up 0.4%, Google Shares Unchanged",0.8975929021835327,0.057037364691495895,0.04536980018019676
336,2018-10-17,"eBay Files Suit Against Amazon, Alleging Amazon Poached Sellers",0.02043757773935795,0.905200719833374,0.07436166703701019
337,2018-10-26,"Stock Rally Looks Poised To Falter After Amazon, Alphabet Results Disappoint",0.009852430783212185,0.9618217349052429,0.028325779363512993
338,2018-11-07,"Several Net-Neutrality-sensitive stocks sharply higher today as US House shifting toward Democrats could be positive for Net Neutrality landscape: Amazon Shares Up 10%, Netflix Up 5.3%, Roku Up 5%",0.9396886229515076,0.02738504484295845,0.035732124000787735
339,2018-11-14,"Oracle Loses Protest Of Pentagon Cloud Bid, Could Be Seen Good For Amazon",0.6284940242767334,0.054937705397605896,0.3165682852268219
340,2018-11-28,Hearing CNBC Reported Amazon Will Drop Oracle Databases By The End Of 2019,0.014436080120503902,0.7178211808204651,0.2677428126335144
341,2018-12-04,Shares of FedEx and UPS are trading down after Morgan Stanley said they face rising competition risks from Amazon Air.,0.5538844466209412,0.9734746217727661,0.10968443006277084
342,2018-12-10,"Hasbro Shares Touch New Session Low, Mattel Shares Appear Unaffected Amid Report 'Amazon Launching First Private Label Toys for Toddlers and Kids'",0.011482958681881428,0.9551499485969543,0.03336714208126068
343,2018-12-11,HubSpot Announces Three-Year Collaboration With Amazon Web Services To Support The Startup Ecosystem,0.8876833915710449,0.007685952354222536,0.10463070124387741
344,2018-12-12,"Red Hat Shares Volatile Here As Traders Circulate 'IBM's $34 billion Red Hat acquisition came after deal talks with Microsoft, Google and Amazon, sources say' -Business Insider",0.09017014503479004,0.6945143342018127,0.21531552076339722
345,2018-12-19,"Facebook Has Another Data Privacy Problem, This Time Involving Amazon, Netflix And More",0.8639715909957886,0.925829291343689,0.12281941622495651
346,2018-12-21,Shares of Air Transport Services are trading higher after the company announced it extended and expanded Aircraft leasing and operating agreements with Amazon.,0.9561607837677002,0.02092118002474308,0.13619357347488403
347,2018-12-27,"UPDATE: RBC On NVIDIA, AMD: 'We have noticed ASPs for GPUs coming down in the secondary market (Newegg, Amazon.com, eBay). For this reason, we adjust our estimates slightly to reflect potential gaming softness'",0.01915101334452629,0.9613298773765564,0.2101413756608963
348,2019-01-04,"Goldman Sees Amazon, Alphabet, PayPal, GrubHub, Netflix As Best Risk/Reward In US Internet Space, Sees Spotify, Twitter As Stocks Which Offer Most Upside From Current Levels",0.8584590554237366,0.009324049577116966,0.13221685588359833
349,2019-01-15,Shares of thinly-traded nano-cap software company BSQUARE Corp are trading higher on heavy volume after the company announced an internet of things collaboration with Amazon Web Services.,0.8973403573036194,0.07642007619142532,0.02623949944972992
350,2019-01-22,"'Apple Most-Admired Global Company, Says Fortune (Amazon #2, Google #7, Alibaba #34, Facebook #44)' -Forbes",0.7434809803962708,0.009798185899853706,0.2467208355665207
351,2019-01-25,"The Information Article 'Amazon Exploring New Programs to Improve Deliveries' Includes Comment '[Amazon] is also in ongoing discussions with home builders including Meritage Homes...about ways to secure deliveries to single-, multi-fam homes'",0.7086529731750488,0.008618916384875774,0.2827281057834625
352,2019-02-01,"Amazon's Q4 Shipping Bill Soared To More Than $9 Billion, Company Reports",0.9317326545715332,0.01541592925786972,0.052851416170597076
353,2019-02-05,CNBC Reports Amazon Makes Clear It's Now Competing With Shippers Like Fedex And Ups In Its Annual Filing,0.9097632169723511,0.01666761003434658,0.0735691636800766
354,2019-02-08,"Hearing CalPERS Reduced Holdings In Apple, Amazon, Microsoft, Exxon Mobil, JP Morgan, Facebook And NVIDIA In Q4",0.016111761331558228,0.9546285271644592,0.02925974503159523
355,2019-02-11,Today's Pickup: A Shortage Of Female Logistics Leaders; An Amazon-Aurora Delivery Tie-In?,0.013758238404989243,0.9157606959342957,0.07048109918832779
356,2019-02-14,"Tiger Global 13F Shows Cut Stakes In Alibaba, Netflix, Facebook, Amazon, Visa",0.9323533773422241,0.9328620433807373,0.1421840786933899
357,2019-02-19,NetEase shares are trading higher following media reports Amazon China is interested in acquiring the company's Kaola division.,0.9349977374076843,0.015845604240894318,0.04915665462613106
358,2019-02-22,'It's becoming clearer than ever that Amazon is developing a third-party logistics service to edge out FedEx and UPS now that Stamps.com has dumped the USPS' -Business Insider,0.34052160382270813,0.42662352323532104,0.23285484313964844
359,2019-02-25,"Amazon Prime Cargo Jet Crashes In Texas, Killing 3",0.011767534539103508,0.9236782789230347,0.06455416977405548
360,2019-03-01,Natural Grocers Shares Fall To Session Low Amid Report Amazon Looking To Open Lower Price Point Grocers Across US,0.1088394895195961,0.9719547629356384,0.03059268556535244
361,2019-03-06,Amazon Says It Will Expand Amazon Books And Amazon 4-Star Stores,0.8651581406593323,0.007467149756848812,0.12737472355365753
362,2019-03-19,Shares of several semiconductor companies are trading higher after NVIDIA teamed up with Amazon Web Services IoT to bring AI to millions of connected devices.,0.9477543830871582,0.032262131571769714,0.3570740520954132
363,2019-03-21,"Wedbush's Katri, In Benzinga Interview On Consolidation In Fintech Space, Highlights Total System Services, Global Payments, PayPal, Square As Potential M&A Targets For Amazon, JP Morgan",0.8189687728881836,0.00924938078969717,0.48833078145980835
364,2019-03-29,Shares of several microchip companies are trading higher on rumors indicating that Amazon has faced quality issues with Samsung chips and may be in talks with competitors about a potential replacement for Samsung if a settlement isn't reached.,0.2885836958885193,0.6801506876945496,0.03126557171344757
365,2019-04-02,Amazon Slashes Whole Foods Prices,0.011889110319316387,0.9307947158813477,0.05731615424156189
366,2019-04-04,"Cigna, Express Scripts Highlight New Collaboration With Amazon Alexa",0.4969518482685089,0.008122939616441727,0.49492520093917847
367,2019-04-10,Oracle And IBM Are Officially Out Of The Race For A Key $10B Defense Cloud Contract As Amazon And Microsoft Move Ahead,0.1973436027765274,0.7046425938606262,0.09801384061574936
368,2019-04-11,"TJI Research Highlights Amazon Launch Of Private Label Energy Drinks, Says They Will Compete With Monster, Red Bull, Rockstar",0.824914276599884,0.007532901596277952,0.16755278408527374
369,2019-04-23,Kohl's shares are trading higher after the company reported that all of its stores would accept free unpackaged returns for Amazon customers starting July.,0.9515950083732605,0.022369442507624626,0.026035474613308907
370,2019-04-24,Why Kohl's Expanded Relationship With Amazon Could Be A 'Game Changer',0.07959557324647903,0.7608805894851685,0.45737767219543457
371,2019-04-26,"Shares of several retail companies are trading lower. Weakness may be due to Amazon announcing one-day delivery for Prime members, which could be perceived as a threat to brick-and-mortar stores.",0.01364272739738226,0.9724760055541992,0.13426320254802704
372,2019-04-29,Shares of companies in the trucking and shipping & logistics space are trading lower amid reports of Amazon launching a freight brokerage service.,0.01407985482364893,0.9662409424781799,0.01967925950884819
373,2019-04-30,"Ford, Amazon To Partner To Bring Amazon's 'Key' In-Car Delivery Service To Eligible Ford, Lincoln Vehicles",0.8101964592933655,0.0064892214722931385,0.18331433832645416
374,2019-05-14,IMAX Issues Press Release Highlighting Will Partner With Amazon Studios For Exclusive Launch Of 'The Aeronauts' To IMAX Theatres Nationwide,0.9512459635734558,0.01622646115720272,0.39470842480659485
375,2019-05-21,"Monro shares trading higher following mixed Q4 results, inline FY20 guidance, a raised quarter dividend and news the company's collaboration with Amazon.com will be expanded.",0.9510020017623901,0.027836376801133156,0.0889902338385582
376,2019-06-03,"Trader Idea Feed: '$SPY breaking the ema support, room lower into the 275.9 area. Range bounce today. Facebook, Google, Amazon ready for next legs down, bear flagging uptrends broken from the bounce.' @SpartanTrading Via Twitter",0.042941559106111526,0.9718090295791626,0.34700310230255127
377,2019-06-06,UK PM Candidate Matt Hancock Vows To 'Save' High Street With Tax Cut For Small Retailers Funded By New Amazon Tax,0.8012856841087341,0.9517722129821777,0.1520751267671585
378,2019-06-07,"Trader Idea Feed: 'FedEx may be dropping Amazon's domestic express contract, but the company says Amazon only was worth **1.3%** of its total revenue for 2018.' @SteveKopack Via Twitter",0.8315100073814392,0.9350074529647827,0.16430072486400604
379,2019-06-10,NovaBay Pharma's Stock Closes Up 870% After Amazon Deal,0.9446413516998291,0.9420099258422852,0.03689275681972504
380,2019-06-11,Investors Back GrubHub As Amazon Shuts Down Restaurants Business,0.18610921502113342,0.9456485509872437,0.053147055208683014
381,2019-06-12,Iconix Shares Up 27% As Amazon URL Circulates,0.9313768744468689,0.08420909196138382,0.20484213531017303
382,2019-06-20,"Despite Talk Of Budding Rivalry, Amazon And UPS May Find They're Stuck With Each Other",0.2909276485443115,0.5560479760169983,0.153024360537529
383,2019-06-21,CNBC: Retail Pharmacies More Worried About Amazon Than They Admit,0.07166867703199387,0.5859217047691345,0.3424097001552582
384,2019-06-25,"Fedex CFO Says Decision to Not Renew Fedex Express Contract With Amazon to Be Near Term Headwind, Which Co Expects to Become a Positive In FY 2021",0.9179286956787109,0.8651410341262817,0.07230203598737717
385,2019-07-01,'Retailers Eager to Lodge Antitrust Complaints Against Amazon and Google' -Bloomberg,0.0422280989587307,0.5746933221817017,0.3830784559249878
386,2019-07-05,Today's Pickup: Amazon's In-House Delivery Network Might Have Problems With Late Deliveries,0.009128512814640999,0.9665959477424622,0.02427547425031662
387,2019-07-11,Billionaire Woos Amazon and Google With Indian Data Hubs,0.527503252029419,0.013526508584618568,0.4589702785015106
388,2019-07-17,Amazon in Deal with German's Federal Cartel Office to Overhaul Marketplace Terms of Service,0.4796184301376343,0.06323616206645966,0.4571453928947449
389,2019-07-23,"Facebook, Amazon, Apple Shares Sharply Lower Following Dept. Of Justice Probe Headline, Google Shares Indicated Lower, Twitter Shares Down Modestly",0.009561684913933277,0.9707870483398438,0.019651174545288086
390,2019-07-25,"ECB Chimes In: Hints Of Rate Cut Could Support Ahead Of Amazon, Alphabet",0.8955023288726807,0.04382305592298508,0.06067463755607605
391,2019-07-26,"FAANG Shares Mixed As Alphabet's Earnings Beat Expectations, Amazon's Fall Short",0.8863775730133057,0.8482304215431213,0.026683960109949112
392,2019-07-27,"This Analyst Sees Upside Potential In Alphabet, Twitter and Amazon",0.6141853332519531,0.03951792046427727,0.3462967872619629
393,2019-08-07,FedEx Will End Ground Shipments Of Amazon Packages,0.018522845581173897,0.9107013940811157,0.1129605695605278
394,2019-08-08,Amazon Seeks FAA Approval For Its Prime Air Drone,0.8666939735412598,0.01149952132254839,0.12180653214454651
395,2019-08-22,"Spectre Of Amazon And Peak Season Looms Over Stalled Talks Between Atlas, ATSG And Teamsters",0.5854080319404602,0.936393678188324,0.40570828318595886
396,2019-08-26,"France's Macron Says President Trump Missed Climate Session at G7 Because Had Other Bilaterals; Macron Says He Had Long Discussion With Trump on Amazon Forest Fires, Trump Backs G7 Initiative",0.016185296699404716,0.8382745981216431,0.14554014801979065
397,2019-08-30,"Bunge Ltd Says Is Evaluating Available Information About Number And Location Of Existing Fires In The Amazon, Committed To Deforestation-Free Supply Chain",0.5901318192481995,0.012860341928899288,0.39700788259506226
398,2019-09-05,Traders Circulating Questionable Chatter Of Amazon M&A Interest In Kohl's,0.016580548137426376,0.9012436270713806,0.08217575401067734
399,2019-09-09,"UPDATE: Baird Maintains Outperform On Shopify, Raises Tgt To $410 As Firm's Latest Checks Suggest Co.'is on track to exceed one million merchant customers by year-end and will surpass eBay as the No.2 e-commerce platform in North America (behind Amazon.)'",0.9511781930923462,0.018421435728669167,0.03040030598640442
400,2019-09-13,Air Transport Services Shares Spike Higher As Traders Circulate Report From Cargo Facts Amazon Is Shifting Its 767-300Fs From Atlas Air To ATSG Carrier Air Transport Int'l. For CMI Flying,0.8306462168693542,0.026165755465626717,0.14318804442882538
401,2019-10-10,Amazon Partner Inpax Lays Off About 600 After Amazon Ends Relationship,0.008583206683397293,0.9380166530609131,0.05340009927749634
402,2019-10-18,"Netflix, Amazon Face Censorship Threat in India",0.012940632179379463,0.8275423645973206,0.1595170646905899
403,2019-10-23,"Amazon Expands Its In-Store Pickup Service Counter, Adds GNC, Health Mart And Stage Stores",0.7040926814079285,0.019800707697868347,0.2761066257953644
404,2019-10-24,Senators Accuse Amazon Of Neglect In Capital One Data Breach,0.01872788369655609,0.9526575803756714,0.09455955773591995
405,2019-10-25,Mid-Morning Market Update: Gold Trades Higher; Amazon Shares Tumble,0.8893795013427734,0.9148103594779968,0.06532727181911469
406,2019-10-28,Report: Amazon Could Challenge Microsoft's Pentagon Contract Award,0.034704212099313736,0.900417685508728,0.06487806141376495
407,2019-11-07,Amazon Air Carrier ATSG Posts Higher Q3 Earnings,0.9379932880401611,0.035070884972810745,0.026935845613479614
408,2019-11-13,Amazon Effect Pushes Traditional Freight Transport Outside Comfort Zone,0.013445128686726093,0.9506341814994812,0.03592066839337349
409,2019-11-18,NovaBay Shares Up 32% Premarket Following News Its NovaSight Daily Vitamin Launched On Amazon.com,0.946757972240448,0.025306634604930878,0.0541488379240036
410,2019-11-19,NovaBay Pharmaceuticals shares are trading lower as a potential sell-off after the stock increased roughly 68% yesterday following the company announcing its NovaSight Daily Vitamin was launched on Amazon.,0.9492983818054199,0.9672812223434448,0.03759635612368584
411,2019-11-21,"UPDATE: Morgan Stanley Maintains Underweight On Kohl's, Lowers Target To $42 Notes 'The Amazon returns program has not been sufficient to turn the tide, putting the bull case out of reach and reinforcing our LT structurally negative view'",0.8713509440422058,0.9622612595558167,0.12115611881017685
412,2019-12-02,NovaBay Pharmaceuticals shares are trading higher after the company announced the launch of its NovaWipes Eyelid Wipes on Amazon.,0.9502694606781006,0.8307607769966125,0.15552739799022675
413,2019-12-03,Amazon.com's Amazing Rise Wins It Top FreightTech 25 Honors,0.9349002838134766,0.016743376851081848,0.04835634306073189
414,2019-12-04,"German Public Broadcaster ARD to Further Expand its Streaming Offer in 2020 to Compete with Netflix, Amazon and Disney",0.9262405633926392,0.008578038774430752,0.09630202502012253
415,2019-12-10,CVS Health shares are trading lower amid the Blue Cross Blue Shield integrating Amazon PillPack into MyBlue customer app news and the lower healthcare act of 2019.,0.01932222582399845,0.9728245735168457,0.02343013323843479
416,2019-12-11,'Still reading positives about the $KSS relationship with Amazon returns' -CNBC's Jim Cramer,0.9273215532302856,0.029781168326735497,0.042897358536720276
417,2019-12-16,Today's Pickup: Tesla's Truck May Not Ride In Europe; Pushback On Morgan Stanley's Amazon Forecast,0.2108408659696579,0.9719465374946594,0.2918958067893982
418,2019-12-17,"PreMarket Prep Recap: Boeing Approaches Key Technical Level, Amazon Forgoes Holiday Spirit With FedEx",0.9196341037750244,0.8866251707077026,0.15839523077011108
419,2019-12-18,"UPDATE: Bank Of America Reiterates Neutral On FedEx, Lowers Target To $163 Notes 'We believe FedEx shares reflect overhang from higher Express/ TNT costs, economic and trade overhang, and the lost Amazon Ground and Express business'",0.044784534722566605,0.9372392296791077,0.056599702686071396
420,2019-12-19,Amazon Says Its Last-Mile Delivery Network Is On Track To Deliver 3.5B Packages In 2019,0.8136918544769287,0.00835531484335661,0.17795279622077942
421,2019-12-26,"Nasdaq Hits 9,000 As Amazon Rallies On 'Record-Breaking' Holiday Numbers",0.549919843673706,0.11662772297859192,0.3334524631500244
422,2019-12-30,Amazon Pays 13 Times More In Taxes With Hopes To Expand Business In Japan,0.8248071670532227,0.00674034608528018,0.16845248639583588
423,2020-01-02,"Today's Pickup: Amazon Driver Stole Package Delivered By UPS, Police Say",0.017956150695681572,0.8661181330680847,0.115925632417202
424,2020-01-15,"Nomura: Netflix, Amazon 'Best Positioned' In The Streaming Wars",0.8246350884437561,0.7709017992019653,0.20412488281726837
425,2020-01-16,"Analyst: Amazon, Wayfair Big Winners From Impressive Online Holiday Sales Growth",0.9486281871795654,0.017533903941512108,0.03383789584040642
426,2020-01-21,"Netflix Highlights Google Search Trend Data Showing Interest For The Witcher Exceeded Interest For Disney's The Mandalorian, Amazon's Jack Ryan And Apple's The Morning Show.",0.6158466339111328,0.33736366033554077,0.04678972437977791
427,2020-01-23,Amazon Urges Court To Halt Progress On Microsoft's JEDI Contract With The Pentagon,0.009247991256415844,0.9234859943389893,0.06726600974798203
428,2020-01-27,"Amazon Employees Publicly Condemn Company's Communications, Climate Policies",0.011182336136698723,0.9078059196472168,0.08101169019937515
429,2020-01-31,PreMarket Prep Recap: Amazon's Huge Q4 Beat Can't Save The Markets,0.028369957581162453,0.8802523612976074,0.09137769043445587
430,2020-02-11,"Deutsche Bank Seeking Bids From Microsoft, Google, Amazon to Overhaul Its Technology",0.9124363660812378,0.01335509680211544,0.07420852035284042
