,Date,Headline,Positive,Negative,Neutral
431,2020-02-14,"Tiger Global Cuts Stakes In Facebook, Netflix, Alibaba, Microsoft, Amazon, Salesforce.com",0.01699901558458805,0.8591590523719788,0.12384197860956192
432,2020-02-18,"BlackBerry shares are trading higher. Strength potentially related to Ontario Teachers' Pension Plan raising its stake in the company. Additionally, traders have circulated a recent Motley Fool article highlighting the company's partnership with Amazon.",0.8137602210044861,0.03872596099972725,0.14751382172107697
433,2020-02-28,"Amazon Removes 1M Products For Claiming To Cure Coronavirus, Inflating Prices",0.015759246423840523,0.9575784206390381,0.026662306860089302
434,2020-03-09,"10 Most Profitable Shorts Since The Coronavirus Sell-Off Ramped Up: Tesla, Amazon And More",0.8826572895050049,0.015990357846021652,0.10135238617658615
435,2020-03-10,HanesBrands Launches Its Popular C9 Champion Brand On Amazon With A Multiyear Exclusive Agreement,0.5454310178756714,0.007912120781838894,0.44665688276290894
436,2020-03-11,Amazon Announces $5M Fund To Help Small Seattle Businesses Tackle Coronavirus Impact,0.8114065527915955,0.014198845252394676,0.1743946224451065
437,2020-03-12,Canadian Solar Signs A Solar Power Purchase Agreement In Australia With Amazon To Supply 146MWp/110 MWac Gunnedah Solar Farm,0.9023851156234741,0.009890969842672348,0.08772391825914383
438,2020-03-16,Today's Pickup: Amazon Insourcing Hurting DHL Globally,0.1002015769481659,0.9699722528457642,0.03406210243701935
439,2020-03-18,"Travel, Airline Stocks In Focus Amid Fresh Weakness; Amazon To Hire 100,000 Workers",0.8374429941177368,0.0977204367518425,0.0648365244269371
440,2020-03-21,Amazon.com Says It Will Stop Shipping Non-essential Products to Consumers in Italy and France,0.01569192111492157,0.7214670181274414,0.2628410756587982
441,2020-03-25,'India's coronavirus lockdown to hammer Amazon and Flipkart sales' -Nikkei,0.03262562304735184,0.8801239132881165,0.08725050836801529
442,2020-03-30,"Amazon Analyst On Positives, Negatives Of Coronavirus Spending: 'A Material Impact'",0.028986582532525063,0.8988595604896545,0.07215389609336853
443,2020-04-02,Amazon Offers Prime Video Purchases On iOS As Apple Foregoes 30% Third-Party Tax,0.702950119972229,0.011833250522613525,0.28521665930747986
444,2020-04-07,"FedEX, UPS Shares Surge As Amazon To Suspend Delivery Service For Third-Party Sellers Due To Increased Demand",0.02448170632123947,0.964409589767456,0.150521382689476
445,2020-04-08,United Parcel Service and FedEx shares are trading higher after Amazon announced it will suspend its delievery service for third-party sellers due to increase in demand. This gives UPS and FedEx the opportunity to deliver more packages.,0.8690890073776245,0.098255954682827,0.032654982060194016
446,2020-04-15,Amazon Cuts Affiliate Commissions In US,0.009788700379431248,0.9598042964935303,0.030407031998038292
447,2020-04-17,Why Amazon Is Trading Down Friday,0.8625683188438416,0.7529757618904114,0.2268189638853073
448,2020-04-20,Flir Shares Spike To Session High As Traders Circulate Comments From William Blair Suggesting Amazon Will Deploy Co. Thermal Cameras At Whole Foods Locations To Screen Employees On Daily Basis For Elevated Temperatures,0.7084633111953735,0.12596605718135834,0.3340821862220764
449,2020-04-21,Flir Shares are trading higher following reports suggesting Amazon could deploy the company's thermal cameras at Whole Foods locations to screen employees for elevated temperatures.,0.9409118890762329,0.02778000757098198,0.03130802512168884
450,2020-04-27,Amazon Statement Shows Co. Extends Closure Of French Warehouses Til May 5,0.015598808415234089,0.811562180519104,0.1728389859199524
451,2020-04-28,Tigress Financial Analyst Ivan Feinseth On Amazon Weakness Notes 'The stock has had an incredible run making new all-time highs in a difficult market' as Co. 'has benefited from being the place to go to during the shelter in place lockdown',0.9397192597389221,0.9656067490577698,0.23267334699630737
452,2020-04-29,"Locked Down, Demand Up: Amazon Shines As Virus Economy Plays To Its Strengths",0.7677891850471497,0.01301403809338808,0.21919675171375275
453,2020-04-30,From Amazon Earnings Conference Call: Sees Investing $1B In Coronavirus-Testing Capability In 2020,0.9549916982650757,0.9728628396987915,0.46279045939445496
454,2020-05-01,"UPDATE: Raymond James Maintains Outperform On Amazon, Raises Target To $2,525 As Firm Cites 4 Reasons:",0.9237660765647888,0.9730134606361389,0.4374174475669861
455,2020-05-02,How Amazon Web Services Stacked Up Against Microsoft's Azure,0.7099719047546387,0.03241904079914093,0.2576090693473816
456,2020-05-04,Amazon Plans To Extend Closure Of French Warehouses Until May 8,0.010602151975035667,0.8719043135643005,0.11749345064163208
457,2020-05-05,"U.S. Immigration And Customs Working With 3M, Amazon, Pfizer & Others To Curtail Imports Of Counterfeit Masks, Coronavirus Tests, Other Gear",0.023120146244764328,0.9280145168304443,0.3588730990886688
458,2020-05-06,"Coronavirus Drives Surge In Online Grocery Penetration For Players Like Amazon Prime Now, Walmart",0.9369277954101562,0.015989715233445168,0.1538483053445816
459,2020-05-07,Amazon Says Planning To Prolong Closure Of French Warehouses Until May 13,0.012733706273138523,0.8282872438430786,0.15897905826568604
460,2020-05-10,"Amazon Worker Claims At Least 600 Employees Struck By COVID-19, Six Dead",0.008043034933507442,0.9603347778320312,0.031622085720300674
461,2020-05-11,"Shares Of AMC Up 71% Pre-Market After Traders Circulate Daily Mail Report That Amazon Is In Talks With Odeon Cinemas, Which AMC Owns",0.9421401023864746,0.9408516883850098,0.3874688446521759
462,2020-05-12,"Amazon Shares Unaffected Amid Report Coalition Of 13 US Attorney Generals Have Asked Co. To Provide Data About Infections, Deaths Among Its Workers, Evidence Co Is In Compliance With State Paid Sick Leave Laws",0.5106263160705566,0.952186107635498,0.30922839045524597
463,2020-05-13,"Retail Pro Says Giants Like Amazon, Walmart Will Prevail After Coronavirus: 'It's Not Fair'",0.6187365651130676,0.8862398266792297,0.38558176159858704
464,2020-05-14,Today's Pickup: COVID-19 Gives Smaller e-Commerce Firms A Chance Against Amazon,0.6879549622535706,0.014363537542521954,0.2976814806461334
465,2020-05-15,"Hedge Fund Duquesne 13F Shows Increased Stakes In Facebook, Alibaba, Netflix, Amazon, Google, Alnylman",0.9394158720970154,0.012124414555728436,0.04845967888832092
466,2020-05-19,"Amazon Announces New Fulfillment Center In Wilmington, Delaware",0.6157360076904297,0.024661174044013023,0.35960280895233154
467,2020-05-26,"Aircraft Prices, E-Commerce Conditions Are Ripe For Amazon Air, Says Bullish BofA",0.9371755719184875,0.01925395242869854,0.47816914319992065
468,2020-05-27,Bezos Says Amazon's Strategy Is To Undercharge For Prime Membership Relative TO ITs value For Customers,0.5429092645645142,0.08833272010087967,0.44043734669685364
469,2020-05-28,Hearing Amazon Has Said It Will Keep 125K Of 175K Jobs Added During Pandemic As Permanent Positions,0.08664018660783768,0.9330793023109436,0.41331931948661804
470,2020-05-29,"UPS Slaps 'Peak' Surcharge On Amazon, Walmart, Others, As Delivery Requests Balloon Post Lockdown Ease",0.015414456836879253,0.9630375504493713,0.021547973155975342
471,2020-05-31,"Amazon, Apple, Walmart, Other Retailers Shutter Stores, Scale Back Operations In Areas Worst Hit With Protests",0.1364598423242569,0.9518177509307861,0.08494708687067032
472,2020-06-01,"UK Supply Chain Startup Beacon Raises $15M From Amazon CEO, Others",0.8013317584991455,0.9612946510314941,0.3620573580265045
473,2020-06-03,Air Transport Services Group Shares Up After Hours Following Amazon Press Release Announcing Lease Of 12 Boeing 767-300 Converted Cargo Aircraft From Co.,0.9292657971382141,0.022338783368468285,0.04839545115828514
474,2020-06-04,Air Transport Services Group shares are trading higher after Amazon announced it leased 12 Boeing aircrafts from Air Transport Services Group.,0.9491585493087769,0.0270804725587368,0.023760970681905746
475,2020-06-08,"Facebook-Backed Jio Platforms Gets $750M From Abu Dhabi Sovereign Fund As It Looks To Challenge Amazon, Walmart In India",0.9045461416244507,0.012546156533062458,0.08290767669677734
476,2020-06-09,"Sonos Shares Spike To Session High, Now Up 9.5%, As Citron's Andrew Left, Currently Interviewing On FOX Business, Said Co. Could Be Acquired By Apple Or Amazon",0.9482896327972412,0.9615630507469177,0.04770391061902046
477,2020-06-10,"Hearing Vertical Group Out Positive On Amazon, Saying Co.'s Ad Spend Revenues Are Increasing As Shipping Bottleneck Issues Begin To Abate",0.9539865851402283,0.02016322687268257,0.025850165635347366
478,2020-06-11,Amazon Places One-Year Moratorium On Police Use Of Facial Recognition Technology,0.018237050622701645,0.5779243111610413,0.4038386344909668
